{
  "schema": "kingdom.karma-foresight/v1",
  "kind": "offline-system-effect-projection",
  "catalog_sha256": "dd63c0dc9cd78f7f2906b67605ac3e6164ac26a7347b5dd7bfa59255187d61b9",
  "declaration": {
    "constellation": "authority-laundering",
    "mechanism": "delegated-authority-without-fresh-proof",
    "system_effect_hypothesis": "capability-without-fresh-authority",
    "boundary_signal": "delegation-chain-crosses-tool-boundary",
    "alternative_hypothesis": "stale-or-ambiguous-delegation"
  },
  "contract": {
    "assessment_unit": "authored-system-effect-hypothesis",
    "constellation_is_authored_not_detected": true,
    "system_effect_is_hypothesized_not_established": true,
    "purpose_is_system_effect_not_person_intent": true,
    "alternative_hypothesis_required": true,
    "person_intent_inferred": false,
    "person_classified": false,
    "identity_fields_allowed": false,
    "payload_fields_allowed": false,
    "free_text_fields_allowed": false,
    "scores_or_ranks": false,
    "aggregation_allowed": false,
    "tracks_repetition": false,
    "cross_run_state": false,
    "automatic_detection": false,
    "automatic_enforcement": false,
    "automatic_rule_update": false,
    "human_review_required_for_action": true,
    "owned_or_authorized_boundary_required": true,
    "retaliation": false,
    "hack_back": false,
    "executes_input": false,
    "executes_response": false,
    "rights_and_debts_unchanged": true,
    "creates_external_effect": false
  },
  "budget": {
    "declarations": 1,
    "passes": 1,
    "catalog_rules": 10,
    "file_bytes_max": 32768,
    "decoded_nodes_max": 512,
    "nesting_depth_max": 8,
    "string_characters_max": 512,
    "output_bytes_max": 16384,
    "automatic_retries": 0,
    "network_calls": 0,
    "external_messages": 0,
    "writes": 0,
    "subprocesses": 0,
    "model_calls": 0,
    "paid_calls": 0,
    "clock_reads": 0,
    "random_draws": 0,
    "payload_bytes_retained": 0,
    "identity_records": 0,
    "cross_run_records": 0
  },
  "breach": {
    "state": "quarantined",
    "action": "stop-without-retry-or-result",
    "source_unchanged": true,
    "submitted_values_echoed": false,
    "partial_projection": false,
    "downstream_effects": false
  },
  "exit": {
    "action": "return-or-discard-one-projection",
    "state_retained": false,
    "history_retained": false,
    "standing_created": false,
    "authority_created": false,
    "follow_up": false
  },
  "non_claims": [
    "A constellation is a reviewed tabletop template, not a detected attack or claim about a person.",
    "A system-effect hypothesis is a possible consequence, not an individual's purpose, intention, guilt, character, or worth.",
    "The required alternative hypothesis does not prove benignity, innocence, authorization, or safety.",
    "Constellations and response rungs are not confidence, severity, scores, ranks, reputation, or access decisions.",
    "Response and learning fields are inert review candidates, not enforcement, deployment, permission, legal advice, or authority.",
    "No payload, prompt, address, identity, credential, target, callback, command, URL, or submitted free text is accepted, retained, rendered, or echoed.",
    "Digests prove reviewed canonical JSON relationships and exact recomputation only; this finite atlas is not exhaustive."
  ]
}
